{
  "schema_version": "0.1.0",
  "item_id": "HIN_POL_001",
  "language": "Hindi",
  "language_variety": "Standard Hindi (romanized)",
  "translation_direction": "Hindi-English",
  "source_type": "ELICITED",
  "source_reference": null,
  "license": "TO_BE_CONFIRMED",
  "review_status": "NEEDS_NATIVE_REVIEW",
  "context": [
    {
      "turn_id": 1,
      "speaker_id": "A",
      "speaker_role": "Professor",
      "text": "Yeh assignment kal shaam tak jama kar dijiye."
    }
  ],
  "source_utterance": {
    "turn_id": 2,
    "speaker_id": "B",
    "speaker_role": "Student",
    "text": "Sir, kya mujhe do din aur mil sakte hain?"
  },
  "literal_gloss": "Sir, can I get two more days?",
  "listener_role": "Professor",
  "relationship": "ACADEMIC",
  "relative_status": "SPEAKER_LOWER",
  "familiarity": "LOW",
  "primary_phenomenon": "POLITENESS_FORMALITY",
  "secondary_phenomena": ["FORMALITY", "SPEECH_ACT"],
  "speech_act": "REQUEST",
  "politeness_level": "RESPECTFUL",
  "formality_level": "FORMAL",
  "stance": "DEFERENTIAL",
  "emotion": "WORRIED",
  "indirectness": "MODERATELY_INDIRECT",
  "code_switch_function": null,
  "context_required": false,
  "context_status": "HELPFUL",
  "minimum_context_window": 1,
  "relevant_context_turns": [1],
  "context_explanation": "The professor's instruction establishes that the student is asking to move a deadline the professor has just set.",
  "preservation_requirement": "The translation must remain a deferential request from a student to a professor.",
  "reference_translations": ["Sir, could I please have two more days?"],
  "acceptable_variants": ["Sir, may I have two more days?"],
  "contrastive_translation": "I need two more days.",
  "contrastive_error": "A deferential request becomes a flat statement of need addressed to a superior.",
  "contrastive_error_category": "POLITENESS_ERROR",
  "severity": "MAJOR",
  "creator_notes": "Test fixture. Mirrors the structure of a real pilot item.",
  "annotator_notes": "",
  "annotator_ids": [],
  "adjudicator_id": null,
  "agreement_status": "NOT_ANNOTATED",
  "annotation_version": "1"
}
